{
  "schema_version": "0.1.0",
  "generation": 1,
  "season": "2026-S4",
  "market_date": "2026-10-15",
  "generated_at": "2026-10-15T23:40:34+08:00",
  "next_settlement_at": "2026-10-16T19:00:00+08:00",
  "files": {
    "species": {
      "path": "species.json",
      "sha256": "34b16384e5b3dd10f019038ca135a3534097ac6e38f4197a88f63ca367388e7e",
      "bytes": 86495,
      "updated_at": "2026-10-15T23:40:34.900677+08:00"
    },
    "daily": {
      "path": "daily/2026-10-15.json",
      "sha256": "8f0fbcf0633ca0a08ed8deb0c74c6d6de7a793562a17523fbbf31f3a70eb2f6d",
      "bytes": 66404,
      "updated_at": "2026-10-15T23:40:34.903742+08:00"
    },
    "balance": {
      "path": "balance.json",
      "sha256": "e9b08c7728ab5a79e5b44210afebea60224ef4c82a5874b1800baa18e54815bf",
      "bytes": 4493,
      "updated_at": "2026-10-15T23:40:34.904181+08:00"
    }
  },
  "pipeline": {
    "sources": [
      {
        "name": "fugle-snapshot-tse",
        "endpoint": "/snapshot/quotes/TSE",
        "record_count": 1538
      },
      {
        "name": "twse-company-profile",
        "endpoint": "/opendata/t187ap03_L",
        "record_count": 1095
      },
      {
        "name": "twse-bwibbu-d",
        "endpoint": "/rwd/zh/afterTrading/BWIBBU_d",
        "record_count": 1081
      },
      {
        "name": "twse-monthly-revenue",
        "endpoint": "/opendata/t187ap05_L",
        "record_count": 1073
      },
      {
        "name": "twse-turnover",
        "endpoint": "/exchangeReport/FMSRFK_ALL",
        "record_count": 33596
      },
      {
        "name": "twse-fundamentals-cache",
        "endpoint": "data/fundamentals",
        "record_count": 50
      },
      {
        "name": "fugle-ticker",
        "endpoint": "/stock/intraday/ticker",
        "record_count": 50
      }
    ],
    "warnings": [
      "hp（revenue）缺值 11 檔，以中位百分位替代：2881, 2882, 2891, 2887, 2885, 2884, 2886, 2880…",
      "matk（revenue_yoy）缺值 11 檔，以中位百分位替代：2881, 2882, 2891, 2887, 2885, 2884, 2886, 2880…"
    ]
  }
}
